{
  "$schema": "https://json-schema.org/draft/2020-12/schema",
  "$id": "https://publisher.genii.foundation/schemas/publication.schema.json",
  "title": "GENII Publisher publication manifest",
  "description": "Framework-neutral configuration and ordered source references for one GENII Publisher publication.",
  "type": "object",
  "additionalProperties": false,
  "required": [
    "schemaVersion",
    "publication",
    "engine",
    "layout",
    "works",
    "routes",
    "boundaries",
    "attribution"
  ],
  "properties": {
    "$schema": {
      "const": "https://publisher.genii.foundation/schemas/publication.schema.json"
    },
    "schemaVersion": {
      "$ref": "#/$defs/schemaVersion"
    },
    "publication": {
      "$ref": "#/$defs/publicationIdentity"
    },
    "engine": {
      "$ref": "#/$defs/engineCompatibility"
    },
    "layout": {
      "$ref": "#/$defs/layout"
    },
    "works": {
      "type": "array",
      "minItems": 1,
      "maxItems": 4999,
      "items": {
        "$ref": "#/$defs/workReference"
      }
    },
    "collections": {
      "type": "array",
      "default": [],
      "maxItems": 9997,
      "items": {
        "$ref": "#/$defs/collectionReference"
      }
    },
    "theme": {
      "$ref": "#/$defs/packageReference"
    },
    "extensions": {
      "type": "array",
      "default": [],
      "maxItems": 512,
      "items": {
        "$ref": "#/$defs/extension"
      }
    },
    "audio": {
      "$ref": "#/$defs/audio"
    },
    "sync": {
      "$ref": "#/$defs/sync"
    },
    "routes": {
      "$ref": "#/$defs/routes"
    },
    "continuity": {
      "$ref": "#/$defs/continuity"
    },
    "boundaries": {
      "$ref": "#/$defs/boundaries"
    },
    "attribution": {
      "$ref": "#/$defs/attribution"
    }
  },
  "$defs": {
    "schemaVersion": {
      "type": "string",
      "const": "1.0",
      "description": "Version of the source manifest contract accepted by this schema."
    },
    "stableId": {
      "type": "string",
      "minLength": 1,
      "maxLength": 128,
      "pattern": "^(?!(?:con|prn|aux|nul|com[1-9]|lpt[1-9])(?:\\.|$))[a-z0-9]+(?:[._-][a-z0-9]+)*$"
    },
    "relativePath": {
      "type": "string",
      "minLength": 1,
      "maxLength": 1024,
      "pattern": "^(?!.*[\\uD800-\\uDFFF])(?!.*[\\u061C\\u200E\\u200F\\u2028-\\u202E\\u2066-\\u2069])(?![A-Za-z]:)(?!/)(?!.*\\\\)(?!.*[<>:\"|*])(?!.*%[0-9A-Fa-f]{2})(?!.*[?#])(?!.*[\\u0000-\\u001F\\u007F])(?!\\.{1,2}(?:/|$))(?!.*\\/\\.{1,2}(?:\\/|$))(?!.*(?:^|/)(?:[Cc][Oo][Nn]|[Pp][Rr][Nn]|[Aa][Uu][Xx]|[Nn][Uu][Ll]|[Cc][Oo][Mm][1-9¹²³]|[Ll][Pp][Tt][1-9¹²³])(?:\\.[^/]*)?(?:/|$))(?!.*[. ](?:/|$))(?!.*//)(?!.*\\/$).+$"
    },
    "nonRootRoutePath": {
      "type": "string",
      "minLength": 2,
      "maxLength": 2048,
      "pattern": "^/(?!/)(?!\\.{1,2}(?:/|$))(?!.*\\/\\.{1,2}(?:\\/|$))(?!.*//)(?!.*(?:%C2%(?:8[0-9A-F]|9[0-9A-F]|A0)|%E1%9A%80|%E2%80%(?:8[0-9A]|A[89F])|%E2%81%9F|%E3%80%80|%EF%BB%BF))(?:[A-Za-z0-9._~!$&'()*+,;=:@/-]|%(?:C[2-9A-F]|D[0-9A-F])%[89AB][0-9A-F]|%E0%[AB][0-9A-F]%[89AB][0-9A-F]|%E(?:[1-C]|[E-F])%[89AB][0-9A-F]%[89AB][0-9A-F]|%ED%[89][0-9A-F]%[89AB][0-9A-F]|%F0%[9AB][0-9A-F]%[89AB][0-9A-F]%[89AB][0-9A-F]|%F[1-3]%[89AB][0-9A-F]%[89AB][0-9A-F]%[89AB][0-9A-F]|%F4%8[0-9A-F]%[89AB][0-9A-F]%[89AB][0-9A-F])+$",
      "description": "A canonical non-root route serialized as ASCII. Non-ASCII Unicode scalar values use uppercase UTF-8 percent encoding; ASCII octets are never percent encoded. Decoded NFC normalization is enforced by semantic validation."
    },
    "nonRootRouteTemplatePath": {
      "type": "string",
      "minLength": 2,
      "maxLength": 2048,
      "pattern": "^/(?!/)(?!\\.{1,2}(?:/|$))(?!.*\\/\\.{1,2}(?:\\/|$))(?!.*//)(?!.*(?:%C2%(?:8[0-9A-F]|9[0-9A-F]|A0)|%E1%9A%80|%E2%80%(?:8[0-9A]|A[89F])|%E2%81%9F|%E3%80%80|%EF%BB%BF))(?:[A-Za-z0-9._~!$&'()*+,;=:@/{}-]|%(?:C[2-9A-F]|D[0-9A-F])%[89AB][0-9A-F]|%E0%[AB][0-9A-F]%[89AB][0-9A-F]|%E(?:[1-C]|[E-F])%[89AB][0-9A-F]%[89AB][0-9A-F]|%ED%[89][0-9A-F]%[89AB][0-9A-F]|%F0%[9AB][0-9A-F]%[89AB][0-9A-F]%[89AB][0-9A-F]|%F[1-3]%[89AB][0-9A-F]%[89AB][0-9A-F]%[89AB][0-9A-F]|%F4%8[0-9A-F]%[89AB][0-9A-F]%[89AB][0-9A-F])+$",
      "description": "A canonical non-root route template serialized as ASCII. Braces are admitted only so a token-specific schema can require one literal route token. Decoded NFC normalization is enforced by semantic validation."
    },
    "routePath": {
      "type": "string",
      "minLength": 1,
      "maxLength": 2048,
      "oneOf": [
        {
          "const": "/"
        },
        {
          "$ref": "#/$defs/nonRootRoutePath"
        }
      ]
    },
    "workRouteTemplate": {
      "allOf": [
        {
          "$ref": "#/$defs/nonRootRouteTemplatePath"
        },
        {
          "type": "string",
          "pattern": "^(?=[^{}]*\\{workId\\}[^{}]*$)"
        }
      ]
    },
    "collectionRouteTemplate": {
      "allOf": [
        {
          "$ref": "#/$defs/nonRootRouteTemplatePath"
        },
        {
          "type": "string",
          "pattern": "^(?=[^{}]*\\{collectionId\\}[^{}]*$)"
        }
      ]
    },
    "packageName": {
      "type": "string",
      "minLength": 1,
      "maxLength": 214,
      "pattern": "^(?:@[a-z0-9][a-z0-9._-]*/)?[a-z0-9][a-z0-9._-]*$"
    },
    "extensionCapability": {
      "type": "string",
      "enum": [
        "content.project",
        "renderer.slot",
        "renderer.client",
        "host.route",
        "host.handler"
      ]
    },
    "jsonObject": {
      "type": "object",
      "additionalProperties": true
    },
    "publisherIdentity": {
      "type": "object",
      "additionalProperties": false,
      "required": [
        "name"
      ],
      "properties": {
        "name": {
          "type": "string",
          "minLength": 1,
          "maxLength": 256
        },
        "url": {
          "type": "string",
          "format": "uri",
          "pattern": "^https?://"
        }
      }
    },
    "publicationIdentity": {
      "type": "object",
      "additionalProperties": false,
      "required": [
        "id",
        "title",
        "language",
        "publisher"
      ],
      "properties": {
        "id": {
          "$ref": "#/$defs/stableId"
        },
        "title": {
          "type": "string",
          "minLength": 1,
          "maxLength": 512
        },
        "description": {
          "type": "string",
          "maxLength": 4096
        },
        "language": {
          "type": "string",
          "pattern": "^[A-Za-z]{2,3}(?:-[A-Za-z0-9]{2,8})*$"
        },
        "canonicalUrl": {
          "type": "string",
          "format": "uri",
          "pattern": "^https?://"
        },
        "publisher": {
          "$ref": "#/$defs/publisherIdentity"
        },
        "metadata": {
          "$ref": "#/$defs/jsonObject"
        }
      }
    },
    "engineCompatibility": {
      "type": "object",
      "additionalProperties": false,
      "required": [
        "compatibility"
      ],
      "properties": {
        "compatibility": {
          "type": "string",
          "minLength": 1,
          "maxLength": 256,
          "description": "SemVer range accepted by the author repository."
        }
      }
    },
    "catalogReference": {
      "type": "object",
      "additionalProperties": false,
      "required": [
        "id"
      ],
      "properties": {
        "id": {
          "$ref": "#/$defs/stableId"
        },
        "manifest": {
          "$ref": "#/$defs/relativePath"
        }
      }
    },
    "workReference": {
      "allOf": [
        {
          "$ref": "#/$defs/catalogReference"
        }
      ],
      "description": "Ordered work reference. Manifest overrides are repository relative."
    },
    "collectionReference": {
      "allOf": [
        {
          "$ref": "#/$defs/catalogReference"
        }
      ],
      "description": "Ordered collection reference. Manifest overrides are repository relative."
    },
    "canonicalLayout": {
      "type": "object",
      "additionalProperties": false,
      "required": [
        "mode"
      ],
      "properties": {
        "mode": {
          "const": "canonical"
        }
      }
    },
    "workLayoutOverride": {
      "type": "object",
      "additionalProperties": false,
      "minProperties": 1,
      "properties": {
        "root": {
          "$ref": "#/$defs/relativePath"
        },
        "manifestTemplate": {
          "type": "string",
          "minLength": 1,
          "maxLength": 1024,
          "allOf": [
            {
              "$ref": "#/$defs/relativePath"
            },
            {
              "type": "string",
              "pattern": "\\{workId\\}"
            }
          ]
        }
      }
    },
    "collectionLayoutOverride": {
      "type": "object",
      "additionalProperties": false,
      "minProperties": 1,
      "properties": {
        "root": {
          "$ref": "#/$defs/relativePath"
        },
        "manifestTemplate": {
          "type": "string",
          "minLength": 1,
          "maxLength": 1024,
          "allOf": [
            {
              "$ref": "#/$defs/relativePath"
            },
            {
              "type": "string",
              "pattern": "\\{collectionId\\}"
            }
          ]
        }
      }
    },
    "layoutOverrides": {
      "type": "object",
      "additionalProperties": false,
      "minProperties": 1,
      "properties": {
        "works": {
          "$ref": "#/$defs/workLayoutOverride"
        },
        "collections": {
          "$ref": "#/$defs/collectionLayoutOverride"
        },
        "assets": {
          "$ref": "#/$defs/relativePath"
        },
        "continuity": {
          "$ref": "#/$defs/relativePath"
        }
      }
    },
    "declaredLayout": {
      "type": "object",
      "additionalProperties": false,
      "required": [
        "mode",
        "overrides"
      ],
      "properties": {
        "mode": {
          "const": "declared"
        },
        "overrides": {
          "$ref": "#/$defs/layoutOverrides"
        }
      }
    },
    "layout": {
      "oneOf": [
        {
          "$ref": "#/$defs/canonicalLayout"
        },
        {
          "$ref": "#/$defs/declaredLayout"
        }
      ]
    },
    "packageReference": {
      "type": "object",
      "additionalProperties": false,
      "required": [
        "package"
      ],
      "properties": {
        "package": {
          "$ref": "#/$defs/packageName"
        },
        "config": {
          "$ref": "#/$defs/jsonObject"
        }
      }
    },
    "extension": {
      "type": "object",
      "additionalProperties": false,
      "required": [
        "id",
        "package",
        "capabilities"
      ],
      "properties": {
        "id": {
          "$ref": "#/$defs/stableId"
        },
        "package": {
          "$ref": "#/$defs/packageName"
        },
        "capabilities": {
          "type": "array",
          "minItems": 1,
          "uniqueItems": true,
          "items": {
            "$ref": "#/$defs/extensionCapability"
          }
        },
        "config": {
          "$ref": "#/$defs/jsonObject"
        }
      }
    },
    "audio": {
      "type": "object",
      "additionalProperties": false,
      "required": [
        "adapter"
      ],
      "properties": {
        "adapter": {
          "$ref": "#/$defs/packageReference"
        },
        "catalog": {
          "$ref": "#/$defs/relativePath"
        }
      }
    },
    "sync": {
      "type": "object",
      "additionalProperties": false,
      "required": [
        "provider",
        "consent",
        "localFallback",
        "capabilities"
      ],
      "properties": {
        "provider": {
          "$ref": "#/$defs/packageReference"
        },
        "consent": {
          "const": "opt-in"
        },
        "localFallback": {
          "const": true
        },
        "capabilities": {
          "type": "array",
          "minItems": 1,
          "uniqueItems": true,
          "items": {
            "$ref": "#/$defs/stableId"
          }
        }
      }
    },
    "routes": {
      "type": "object",
      "additionalProperties": false,
      "required": [
        "home",
        "work"
      ],
      "properties": {
        "home": {
          "$ref": "#/$defs/routePath"
        },
        "work": {
          "$ref": "#/$defs/workRouteTemplate"
        },
        "collection": {
          "$ref": "#/$defs/collectionRouteTemplate"
        },
        "updates": {
          "$ref": "#/$defs/routePath"
        }
      }
    },
    "redirectTarget": {
      "oneOf": [
        {
          "$ref": "#/$defs/routePath"
        },
        {
          "type": "string",
          "format": "uri",
          "pattern": "^https?://"
        }
      ]
    },
    "redirect": {
      "type": "object",
      "additionalProperties": false,
      "required": [
        "from",
        "to",
        "status"
      ],
      "properties": {
        "from": {
          "$ref": "#/$defs/routePath"
        },
        "to": {
          "$ref": "#/$defs/redirectTarget"
        },
        "status": {
          "type": "integer",
          "enum": [
            301,
            302,
            307,
            308
          ]
        }
      }
    },
    "continuity": {
      "type": "object",
      "additionalProperties": false,
      "required": [
        "redirects"
      ],
      "properties": {
        "redirects": {
          "type": "array",
          "default": [],
          "maxItems": 10000,
          "items": {
            "$ref": "#/$defs/redirect"
          }
        }
      }
    },
    "boundaries": {
      "type": "object",
      "additionalProperties": false,
      "required": [
        "sourceRoots",
        "outputRoots"
      ],
      "properties": {
        "sourceRoots": {
          "type": "array",
          "minItems": 1,
          "maxItems": 64,
          "uniqueItems": true,
          "items": {
            "$ref": "#/$defs/relativePath"
          }
        },
        "outputRoots": {
          "type": "array",
          "minItems": 1,
          "maxItems": 64,
          "uniqueItems": true,
          "items": {
            "$ref": "#/$defs/relativePath"
          }
        }
      }
    },
    "attribution": {
      "type": "object",
      "additionalProperties": false,
      "required": [
        "placement",
        "copyright",
        "text",
        "url",
        "sourceCodeUrl"
      ],
      "properties": {
        "placement": {
          "const": "footer"
        },
        "copyright": {
          "const": "Copyright 2026 GENII Foundation"
        },
        "text": {
          "const": "Published with GENII Publisher"
        },
        "url": {
          "const": "https://publisher.genii.foundation"
        },
        "sourceCodeUrl": {
          "type": "string",
          "format": "uri",
          "pattern": "^https?://"
        }
      }
    }
  }
}
